symbol,organ_name,en_organ_name,exchange,type
TCB,Ngân hàng TMCP Kỹ thương Việt Nam,Vietnam Technological and Commercial Joint Stock Bank,HOSE,stock
VGI,Tổng Công ty cổ phần Đầu tư Quốc tế Viettel,Viettel Global Investment Joint Stock Company,UPCOM,stock
VKP,CTCP Nhựa Tân Hóa,Viky Plastic Joint Stock Company,UPCOM,stock
DMS,CTCP Hóa phẩm Dầu khí DMC - Miền Nam,DMC - Southern Petroleum Chemicals Joint Stock Company,UPCOM,stock
AGM,CTCP Xuất Nhập khẩu An Giang,An Giang Import - Export Company,UPCOM,stock
BKC,CTCP Khoáng sản Bắc Kạn,Bac Kan Mineral Joint Stock Corporation,HNX,stock
VGS,CTCP Ống thép Việt - Đức VG PIPE,Vietnam Germany Steel Pipe Joint Stock Company,HNX,stock
POB,CTCP Xăng dầu Dầu khí Hưng Yên,PetroVietnam Oil Hung Yen Joint Stock Company,UPCOM,stock
VNG,CTCP Du lịch Thành Thành Công,Thanh Thanh Cong Tourist Joint Stock Company,HOSE,stock
PVL,CTCP Địa ốc Dầu khí,Petroleum Real Estate Joint Stock Company,UPCOM,stock
ACE,CTCP Bê tông Ly tâm An Giang,An Giang Centrifugal Concrete JSC,UPCOM,stock
IDC,Tổng Công ty IDICO - CTCP,IDICO Corporation - JSC,HNX,stock
VLG,CTCP VIMC Logistics,VIMC Logistics Joint Stock Company,UPCOM,stock
TRV,CTCP Vận tải Đường sắt,Railway Transport Joint Stock Company,UPCOM,stock
PVO,CTCP Dầu nhờn PV Oil,PV Oil Lube Joint Stock Company,UPCOM,stock
GTD,CTCP Giầy Thượng Đình,Thuong Dinh Footwear Joint Stock Company,UPCOM,stock
NTT,CTCP Dệt - May Nha Trang,Nha Trang Textile & Garment Joint Stock Company,UPCOM,stock
BSD,"CTCP Bia, Rượu Sài Gòn - Đồng Xuân","Sai Gon - Dong Xuan Beer, Alcohol Joint Stock Company",UPCOM,stock
IJC,CTCP Phát triển Hạ tầng Kỹ thuật,Becamex Infrastructure Development Joint Stock Company,HOSE,stock
KOS,CTCP KOSY,KOSY Joint Stock Company,HOSE,stock
CCM,CTCP khoáng sản và Xi măng Cần Thơ,Can Tho Mineral and Cement Joint Stock Company,UPCOM,stock
THT,CTCP Than Hà Tu - Vinacomin,Vinacomin - Ha Tu Coal Joint Stock Company,HNX,stock
MGC,CTCP Địa chất mỏ - TKV,Vinacomin - Mining Geology Joint Stock Company,UPCOM,stock
VMT,CTCP Giao nhận Vận tải miền Trung,Vinatrans DaNang Joint Stock Company,UPCOM,stock
MHC,CTCP MHC,MHC Joint Stock Company,HOSE,stock
VTD,CTCP Vietourist Holdings,Vietourist Holdings Joint Stock Company,UPCOM,stock
PGI,Tổng Công ty cổ phần Bảo hiểm Petrolimex,Petrolimex Insurance Corporation,HOSE,stock
LMH,CTCP Quốc Tế Holding,Quoc Te Holding Joint Stock Company,UPCOM,stock
TNM,CTCP Xuất nhập khẩu và Xây dựng Công trình,Tranimexco Transportation Import - Export and Contruction Joint Stock Company,UPCOM,stock
SBT,CTCP Thành Thành Công - Biên Hòa,Thanh Thanh Cong - Bien Hoa Joint Stock Company,HOSE,stock
LLM,Tổng Công ty Lắp máy Việt Nam - CTCP,VietNam Machinery Installation Corporation - JSC,UPCOM,stock
TMW,CTCP Tổng hợp Gỗ Tân Mai,Tan Mai General Wood Joint Stock Company,UPCOM,stock
NBW,CTCP Cấp nước Nhà Bè,Nha Be Water Supply Joint Stock Company,HNX,stock
HPO,CTCP Công nghiệp Hapulico,Hapulico Industry Joint Stock Company,UPCOM,stock
KSQ,CTCP CNC Capital Việt Nam,CNC Capital Viet Nam Joint Stock Company,UPCOM,stock
HSV,CTCP Tập đoàn HSV Việt Nam,HSV Viet Nam Group Joint Stock Company,UPCOM,stock
BTU,CTCP Công trình Đô thị Bến Tre,Bentre Urban Project Joint Stock Company,UPCOM,stock
VXT,CTCP Kho vận và Dịch vụ Thương mại,Transport Warehousing and Trade Service Joint Stock Company,UPCOM,stock
PXT,CTCP Xây lắp Đường ống Bể chứa Dầu khí,Petroleum Pipeline and Tank Construction Joint Stock Company,UPCOM,stock
ANV,CTCP Nam Việt,Nam Viet Corporation,HOSE,stock
TNV,CTCP Thống Nhất Hà Nội,Thong Nhat Ha Noi Joint Stock Company,UPCOM,stock
CST,CTCP Than Cao Sơn - TKV,Cao Son Coal Joint Stock Company,HNX,stock
HVX,CTCP Xi măng VICEM Hải Vân,Vicem Hai Van Cement Joint Stock Company,UPCOM,stock
TAW,CTCP Cấp nước Trung An,Trung An Water Supply Joint Stock Company,UPCOM,stock
NT2,CTCP Điện lực Dầu khí Nhơn Trạch 2,PetroVietnam Power Nhon Trach 2 Joint Stock Company,HOSE,stock
MWG,CTCP Đầu tư Thế giới Di động,Mobile World Investment Corporation,HOSE,stock
WSS,CTCP Chứng khoán Phố Wall,Wall Street Securities Company,HNX,stock
CFV,CTCP Cà phê Thắng Lợi,Thang Loi Coffee Joint Stock Company,UPCOM,stock
HWS,CTCP Cấp nước Huế,Hue Water Supply Joint Stock Company,UPCOM,stock
SSN,CTCP Xuất nhập khẩu Thủy sản Sài Gòn,Saigon SeaProducts Import Export Joint Stock Corporation,UPCOM,stock
TNA,CTCP Thương mại Xuất nhập khẩu Thiên Nam,Thien Nam Trading - Import  Export Joint Stock Company,UPCOM,stock
TNG,CTCP Đầu tư và Thương mại TNG,TNG Investment and Trading Joint Stock Company,HNX,stock
SJM,CTCP Sunspace Holdings,Sunspace Holdings Joint Stock Company,UPCOM,stock
GEX,CTCP Tập đoàn GELEX,GELEX Group Joint Stock Company,HOSE,stock
FOX,CTCP Viễn thông FPT,FPT Telecom Joint Stock Company,UPCOM,stock
MDA,CTCP Môi trường Đô thị Đông Anh,Dong Anh Urban Environment Joint Stock Company,UPCOM,stock
HDW,CTCP Kinh doanh Nước sạch Hải Dương,Hai Duong Water Joint Stock Company,UPCOM,stock
IDP,CTCP Sữa Quốc tế Lof,Lof International Dairy Products Joint Stock Company,UPCOM,stock
EME,CTCP Điện cơ,Electro Mechanical Corporation,UPCOM,stock
DTE,CTCP Đầu tư Năng lượng Đại Trường Thành Holdings,Dai Truong Thanh Holdings Energy Investment Joint Stock Company,UPCOM,stock
PEQ,CTCP Thiết bị Xăng dầu Petrolimex,Petrolimex Equipment Joint Stock Company,UPCOM,stock
IRC,CTCP Cao su Công nghiệp,Industrial Rubber Joint Stock Company,UPCOM,stock
CAD,CTCP Chế biến và Xuất nhập khẩu Thủy sản Cadovimex,Cadovimex Seafood Import-Export and Processing Joint Stock Company,UPCOM,stock
VNL,CTCP Logistics Vinalink,Vinalink Logistics Joint Stock Company,HOSE,stock
KHP,CTCP Điện lực Khánh Hòa,Khanh Hoa Power Joint Stock Company,HOSE,stock
PVV,CTCP Vinaconex 39,Vinaconex 39 Joint Stock Company,UPCOM,stock
PSH,CTCP Thương mại Đầu tư Dầu khí Nam Sông Hậu,Nam Song Hau Trading Investing Petroleum Joint Stock Company,UPCOM,stock
PTP,CTCP PTP,PTP Joint Stock Company,UPCOM,stock
VKC,CTCP VKC Holdings ,VKC Holdings Joint Stock Company,UPCOM,stock
HTN,CTCP Hưng Thịnh Incons,Hung Thinh Incons Joint Stock Company,HOSE,stock
IME,CTCP Cơ khí và Xây lắp Công nghiệp,Mechanical and Industrial Construction Joint Stock Company,UPCOM,stock
TCL,CTCP Đại lý Giao nhận Vận tải Xếp dỡ Tân Cảng,Tan Cang Logistics and Stevedoring Joint Stock Company,HOSE,stock
VIC,Tập đoàn VINGROUP - CTCP,Vingroup Joint Stock Company,HOSE,stock
REE,CTCP Cơ Điện Lạnh,Refrigeration Electrical Engineering Corporation,HOSE,stock
TUG,CTCP Lai Dắt và Vận tải Cảng Hải Phòng,Haiphong Port Tugboat and Transport Joint Stock Company,UPCOM,stock
TNT,CTCP Tập đoàn TNT,TNT Group Joint Stock Company,HOSE,stock
BCC,CTCP Xi măng Bỉm Sơn,Bim Son Cement Joint Stock Company,HNX,stock
KDM,CTCP Tập Đoàn GCL,GCL Group Joint Stock Company,HNX,stock
FDC,CTCP Ngoại thương và  Phát triển Đầu tư Thành phố Hồ Chí Minh,Foreign Trade Development & Investment Corporation of HCMC,HOSE,stock
LEC,CTCP Bất động sản Điện lực Miền Trung,Central Power Real Estate Joint Stock Company,UPCOM,stock
SCC,CTCP Thương mại Đầu tư SHB,SHB Trading Investment Joint Stock Company,UPCOM,stock
GTT,CTCP Thuận Thảo,Thuan Thao Corporation,UPCOM,stock
HLB,CTCP Bia và Nước giải khát Hạ Long,HaLong Beer and Beverage Joint Stock Company,UPCOM,stock
DST,CTCP Đầu tư Sao Thăng Long,Sao Thang Long Investment Joint Stock Company,HNX,stock
PTT,CTCP Vận tải Dầu khí Đông Dương,Indochina Petroleum Transportation Joint Stock Company,UPCOM,stock
CCP,CTCP Cảng Cửa Cấm Hải Phòng,Hai Phong Cua Cam Port Joint Stock Company,UPCOM,stock
VCM,CTCP BV Life,BV Life Joint Stock Company,HNX,stock
VCX,CTCP Xi măng Yên Bình,YenBinh Cement Joint - Stock Company,UPCOM,stock
DCS,CTCP Tập đoàn EDX,EDX Holding Joint Stock Company,UPCOM,stock
BT1,CTCP Bảo vệ Thực vật 1 Trung Ương,Central Plant Protection Joint Stock Company No.1,UPCOM,stock
CDC,CTCP Chương Dương,Chuong Duong Corporation,HOSE,stock
C92,CTCP Xây dựng và Đầu tư 492, Construction & Investment JSC No 492,UPCOM,stock
LKW,CTCP Cấp nước Long Khánh,Long Khanh Water Supply Joint Stock Company,UPCOM,stock
HBH,CTCP Habeco - Hải Phòng,Habeco - Hai Phong Joint Stock Company,UPCOM,stock
TDP,CTCP Thuận Đức,Thuan Duc Joint Stock Company,HOSE,stock
VFR,CTCP Vận tải và Thuê tàu,Transport And Chartering Corporation,UPCOM,stock
TLT,CTCP Viglacera Thăng Long,Viglacera Thanglong Joint  Stock Company,UPCOM,stock
SSB,Ngân hàng TMCP Đông Nam Á,Southeast Asia Commercial Joint Stock Bank,HOSE,stock
CTF,CTCP City Auto,City Auto Corporation,HOSE,stock
HPT,CTCP Dịch vụ Công nghệ Tin học HPT,HPT Viet Nam Corporation,UPCOM,stock
PHH,CTCP Hồng Hà Việt Nam,Hong Ha Viet Nam Joint Stock Company,UPCOM,stock
CNA,CTCP Tổng Công ty Chè Nghệ An,Nghe An Tea Corporation Joint Stock Company,UPCOM,stock
TPB,Ngân hàng TMCP Tiên Phong,Tien Phong Commercial Joint Stock Bank,HOSE,stock
HLC,CTCP Than Hà Lầm - Vinacomin,Vinacomin - Ha Lam Coal Joint Stock Company,HNX,stock
AIC,Tổng Công ty Cổ phần Bảo hiểm DBV,DBV Insurance Group Joint Stock Company,UPCOM,stock
DOC,CTCP Vật tư Nông Nghiệp Đồng Nai,Dong Nai Joint Stock Company of Agricultural Material,UPCOM,stock
VLB,CTCP Xây dựng và Sản xuất Vật liệu xây dựng Biên Hòa,Bien Hoa Building Materials Production and Construction Joint Stock Company,UPCOM,stock
PVC,Tổng Công ty Hóa chất và Dịch vụ Dầu khí - CTCP,PetroVietnam Chemical and Services Joint Stock Corporation,HNX,stock
VHM,CTCP Vinhomes,Vinhomes Joint Stock Company,HOSE,stock
PTV,CTCP Thương mại Dầu khí,Petroleum Trading Joint Stock Company,UPCOM,stock
SAM,CTCP SAM Holdings,SAM Holdings Corporation,HOSE,stock
HSI,CTCP Vật tư Tổng hợp và Phân bón Hóa Sinh,General Materials Biochemistry Fertilizer Joint Stock Company,UPCOM,stock
SPV,CTCP Thủy Đặc sản,Special Aquatic Products Joint Stock Company,UPCOM,stock
VTH,CTCP Dây cáp Điện Việt Thái,Viet Thai Electric Cable Corporation,HNX,stock
VE9,CTCP Đầu tư và Xây dựng VNECO 9,VNECO 9 Investment & Construction Joint Stock Company,UPCOM,stock
KCB,CTCP khoáng Sản và Luyện Kim Cao Bằng,Cao Bang Mineral and Metallurgical Joint Stock Company,UPCOM,stock
TTB,CTCP TTBGroup,TTBGroup Joint Stock Company,UPCOM,stock
QCC,CTCP Đầu tư Xây dựng và Phát triển Hạ tầng Viễn thông,Construction Investment and Telecommunications Infrastructure Development Joint Stock Company,UPCOM,stock
PMJ,CTCP Vật tư Bưu Điện,Posts and Telecommunications Material Supply Joint Stock Company,UPCOM,stock
DTA,CTCP Đệ Tam,De Tam Joint Stock Company,HOSE,stock
TBD,Tổng Công ty Thiết bị Điện Đông Anh - CTCP,Dong Anh Electrical Equipment Corporation - Joint Stock Company,UPCOM,stock
TSB,CTCP Ắc quy Tia Sáng,Tia Sang Battery Joint Stock Company,HNX,stock
NLS,CTCP Cấp thoát nước Lạng Sơn,Lang Son Water Supply and Drainage Joint Stock Company,UPCOM,stock
CII,CTCP Đầu tư Hạ tầng Kỹ thuật Thành phố Hồ Chí Minh,Ho Chi Minh City Infrastructure Investment Joint Stock Company,HOSE,stock
TMT,CTCP Ô tô TMT,TMT Motors Corporation,HOSE,stock
HAN,Tổng Công ty Xây dựng Hà Nội - CTCP,Hanoi Construction Corporation - Joint Stock Company,UPCOM,stock
DDM,CTCP Hàng Hải Đông Đô,Dong Do Marine Joint Stock Company,UPCOM,stock
SGH,CTCP Khách sạn Sài Gòn,Sai Gon Hotel Corporation ,HNX,stock
NET,CTCP Bột giặt NET,NET Detergent Joint Stock Company,HNX,stock
DSE,CTCP Chứng khoán DNSE,DNSE Securities Joint Stock Company,HOSE,stock
L45,CTCP Lilama 45.1,Lilama 45.1 Joint Stock Company,UPCOM,stock
TOT,CTCP Transimex Logistics,Transimex Logistics Corporation,HNX,stock
RCD,CTCP  Xây dựng - Địa ốc Cao su,Rubber Real Estate Construction Joint Stock Company,UPCOM,stock
VC5,CTCP Xây dựng Số 5,Construction Joint Stock Company No 5,UPCOM,stock
DNA,CTCP Điện Nước An Giang,An Giang Power and Water Supply Joint Stock Company,UPCOM,stock
RAL,CTCP Bóng đèn Phích nước Rạng Đông,Rang Dong Light Source and Vacuum Flask Joint Stock Company,HOSE,stock
VSC,CTCP Container Việt Nam,Vietnam Container Shipping Joint Stock Corporation,HOSE,stock
CC1,Tổng Công ty Xây dựng Số 1 - CTCP,Construction Corporation No 1 Joint Stock Company,UPCOM,stock
SDN,CTCP Sơn Đồng Nai,Dong Nai Paint Corporation,HNX,stock
SP2,CTCP Thủy điện Sử Pán 2,Su Pan 2 Hydroprwer Joint Stock Company,UPCOM,stock
PMG,CTCP Đầu tư và Sản xuất Petro Miền Trung,Petro Center Corporation,HOSE,stock
DSD,CTCP DHC Suối Đôi,DHC Suoi Doi Corporation,UPCOM,stock
CCV,CTCP Tư vấn Xây dựng Công nghiệp và Đô thị Việt Nam,VCC Engineering Consultants Joint - Stock Company,UPCOM,stock
PXL,CTCP Đầu tư Khu Công nghiệp Dầu khí Long Sơn,Long Son Petroleum Industrial Zone Investment Joint Stock Company,UPCOM,stock
MFS,CTCP Dịch vụ Kỹ thuật Mobifone,Mobifone Technical Services Joint Stock Company,UPCOM,stock
OIL,Tổng Công ty Dầu Việt Nam - CTCP,PetroVietnam Oil Corporation,UPCOM,stock
HAS,CTCP Hacisco,Hacisco Joint Stock Company,HOSE,stock
TVT,Tổng Công ty Việt Thắng - CTCP,Viet Thang Corporation,HOSE,stock
PSD,CTCP Dịch vụ Phân phối Tổng hợp Dầu khí,Petroleum General Distribution Services Joint Stock Company,HNX,stock
SHE,CTCP Phát triển Năng lượng Sơn Hà,Son Ha Development of Renewable Energy Joint Stock Company,HNX,stock
DSH,CTCP Đầu tư Hạ tầng Đông Sơn,Dong Son Infrastructure Investment Joint Stock Company,UPCOM,stock
X77,CTCP Thành An 77,Thanh An 77 Joint Stock Company,UPCOM,stock
VMS,CTCP Phát triển Hàng Hải,Vietnam Maritime Development Joint Stock Company,HNX,stock
CDG,CTCP Cầu Đuống,Cau Duong Joint Stock Company,UPCOM,stock
HTC,CTCP Thương mại Hóc Môn,HocMon Trade Joint Stock Company,HNX,stock
NAG,CTCP Tập đoàn Nagakawa,Nagakawa Group Joint Stock Company,HNX,stock
PTE,CTCP Xi măng Phú Thọ,Phu Tho Cement Joint Stock Company,UPCOM,stock
POV,CTCP Xăng dầu Dầu khí Vũng Áng,Vung Ang Petroleum Joint Stock Company,UPCOM,stock
HD2,CTCP Đầu tư Phát triển Nhà HUD2,Housing Development Investment Joint Stock Company HUD2,UPCOM,stock
SKN,CTCP Nước giải khát Sanna Khánh Hòa,Sanna Khanh Hoa Beverage Joint Stock Company,UPCOM,stock
DTD,CTCP Đầu tư Phát triển Thành Đạt,Thanh Dat Investment Development Joint Stock Company,HNX,stock
CPH,CTCP Phục vụ Mai táng Hải Phòng,HaiPhong Funeral Services Joint Stock Company,UPCOM,stock
SD3,CTCP Sông Đà 3,Song Da 3 Joint Stock Company,UPCOM,stock
TBC,CTCP Thủy điện Thác Bà,Thac Ba Hydro Power Joint Stock Company,HOSE,stock
DAE,CTCP Sách Giáo dục tại Thành phố Đà Nẵng,Educational Book Joint Stock Company in Da Nang City,HNX,stock
DHT,CTCP Dược phẩm Hà Tây,Ha Tay Pharmaceutical Joint Stock Company,HNX,stock
CAT,CTCP Thủy sản Cà Mau,Seaprimexco-Vietnam,UPCOM,stock
HID,CTCP Halcom Việt Nam,Halcom Vietnam Joint Stock Company,HOSE,stock
HPM,CTCP Xây dựng Thương mại và Khoáng Sản Hoàng Phúc,Hoang Phuc Mineral Trading and Contruction Joint Stock Company,UPCOM,stock
GCB,CTCP Petec Bình Định,Petec Binh Dinh Joint Stock Company,UPCOM,stock
V12,CTCP Xây dựng Số 12,Viet Nam Construction Joint Stock Company No 12,HNX,stock
PTD,CTCP Thiết kế Xây dựng Thương mại Phúc Thịnh,Phuc Thinh Design Construction Trading Corporation,HNX,stock
CHP,CTCP Thủy điện Miền Trung,Central Hydropower Joint Stock Company,HOSE,stock
SIV,CTCP SIVICO,SIVICO Joint Stock Company,UPCOM,stock
DWC,CTCP Cấp nước Đắk Lắk,DAKLAK Water Supply Joint Stock Company,UPCOM,stock
UDL,CTCP Đô thị và Môi trường Đắk Lắk,Dak Lak Urban and Enviroment Joint Stock Company,UPCOM,stock
TID,CTCP Tổng Công ty Tín Nghĩa,Tin Nghia Corporation,UPCOM,stock
VHC,CTCP Vĩnh Hoàn,Vinh Hoan Corporation,HOSE,stock
DMC,CTCP Xuất nhập khẩu Y Tế DOMESCO,DOMESCO Medical Import-Export Joint Stock Corporation,HOSE,stock
PSG,CTCP Đầu Tư và Xây lắp Dầu khí Sài Gòn,Sai Gon Petroleum Construction and Investment Joint Stock Company,UPCOM,stock
VC6,CTCP Xây dựng và Đầu tư Visicons,Visicons Construction and Investment Joint Stock Company,HNX,stock
XLV,CTCP Xây Lắp và Dịch vụ Sông Đà,Song Da Construction and Service Joint Stock Company,UPCOM,stock
BHP,CTCP Bia Hà Nội - Hải Phòng,Ha Noi - Hai Phong Beer JSC,UPCOM,stock
DHN,CTCP Dược phẩm Hà Nội,Ha Noi Pharmar Joint Stock Company,UPCOM,stock
MTS,CTCP Vật tư - TKV,Vinacomin - Materials Trading Joint Stock Company,UPCOM,stock
TV2,CTCP Tư vấn Xây dựng Điện 2,Power Engineering Consulting Joint Stock Company 2,HOSE,stock
MCH,CTCP Hàng tiêu dùng Masan,Masan Consumer Corporation,HOSE,stock
EIC,CTCP EVN Quốc tế,EVN International Joint Stock Company,UPCOM,stock
FSO,CTCP Cơ khí đóng tàu Thủy sản Việt Nam,Viet Nam Fishery Mechanical Shipbuilding Joint Stock Company,UPCOM,stock
VTP,Tổng Công ty cổ phần Bưu chính Viettel,Viettel Post Joint Stock Corporation,HOSE,stock
TTE,CTCP Đầu tư Năng lượng Trường Thịnh,Truong Thinh Energy Investment Joint Stock Company,HOSE,stock
DHA,CTCP Hóa An,Hoa An Joint Stock Company,HOSE,stock
BLN,CTCP Vận tải và Dịch vụ Liên Ninh,Lien Ninh Transport and Service Joint Stock Company,UPCOM,stock
MTP,CTCP Dược Medipharco,Medipharco Pharmaceutical Joint Stock Company,UPCOM,stock
CCL,CTCP Đầu tư và Phát triển Đô thị Dầu khí Cửu Long,Cuu Long Petro Urban Development and Investment Corporation,HOSE,stock
ODE,CTCP Tập đoàn Truyền thông và Giải trí ODE,ODE Media and Entertainment Group Joint Stock Company,UPCOM,stock
FBC,CTCP Cơ khí Phổ Yên,Pho Yen Mechanical Joint Stock Company,UPCOM,stock
EBS,CTCP Sách Giáo dục tại Thành phố Hà Nội,Educational Book Joint Stock Company in Hanoi City,HNX,stock
GER,CTCP Thể thao Ngôi sao Geru,Geru Star Sport Joint Stock Company,UPCOM,stock
TIP,CTCP Phát triển Khu Công nghiệp Tín Nghĩa,Tin Nghia Industrial Park Development Joint Stock Company,HOSE,stock
TIX,CTCP Sản xuất Kinh doanh Xuất nhập khẩu Dịch vụ và Đầu tư Tân Bình,Tan Binh Import - Export Joint Stock Corporation,HOSE,stock
BMK,CTCP Kỹ thuật nhiệt Mèo Đen,Black Cat Insulation Technical Joint Stock Company,UPCOM,stock
SHA,CTCP Sơn Hà Sài Gòn,Son Ha Sai Gon Joint Stock Company,HOSE,stock
SZE,CTCP Môi trường Sonadezi,Sonadezi Environment Joint Stock Company,UPCOM,stock
SHG,Tổng Công ty cổ phần Sông Hồng,Song Hong Joint Stock Corporation,UPCOM,stock
VNC,CTCP Tập đoàn Vinacontrol,Vinacontrol Group Corporation,HNX,stock
BTS,CTCP Xi măng VICEM Bút Sơn,Vicem But Son Cement Joint Stock Company,HNX,stock
FRM,CTCP Lâm Nghiệp Sài Gòn,Sai Gon Forestry Import Export Joint Stock Company,UPCOM,stock
NHA,Tổng Công ty Đầu tư Phát triển Nhà và Đô thị Nam Hà Nội,Ha Noi South Housing and Urban Development Corporation,HOSE,stock
STD,CTCP Bia - Nước giải khát Sài Gòn - Tây Đô,Sai Gon Tay Do Beer - Beverage Joint Stock Company,UPCOM,stock
ANT,CTCP Rau quả Thực phẩm An Giang,An Giang Fruit-Vegetables & Foodstuff Joint Stock Company,HOSE,stock
BHA,CTCP Thủy điện Bắc Hà,Bac Ha Hydropower Joint Stock Company,UPCOM,stock
VIM,CTCP Khoáng sản Viglacera,Viglacera Mineral Joint Stock Company,UPCOM,stock
ABC,CTCP Truyền thông VMG,VMG Media Joint Stock Company,UPCOM,stock
PGD,CTCP Phân phối khí thấp áp Dầu khí Việt Nam,PetroVietNam Low Pressure Gas Distribution Joint Stock Company,HOSE,stock
VE2,CTCP Xây dựng Điện VNECO 2,VNECO 2 Electricity Construction Joint Stock Company,UPCOM,stock
VTI,CTCP Sản xuất - Xuất nhập khẩu Dệt may,Textile - Garment Import - Export and Production Joint Stock Company,UPCOM,stock
S72,CTCP Sông Đà 7.02,Song Da 7.02 Hydroelectric Joint Stock Company,UPCOM,stock
LSG,CTCP Bất động sản Sài Gòn Vina,Saigon Vina Land Joint Stock Company,UPCOM,stock
CCT,CTCP Cảng Cần Thơ,CanTho Port Joint Stock Company,UPCOM,stock
PSW,CTCP Phân bón và Hóa chất Dầu khí Tây Nam Bộ,South West PetroVietnam Fertilizer and Chemicals Joint Stock Company,HNX,stock
HNA,CTCP Thủy điện Hủa Na,Hua Na Hydropower Joint Stock Company,HOSE,stock
DNP,CTCP DNP Holding,DNP Holding Joint Stock Company,HNX,stock
BNW,CTCP Nước sạch Bắc Ninh,Bac Ninh Clean Water Joint Stock Company,UPCOM,stock
CAP,CTCP Lâm Nông sản Thực phẩm Yên Bái,Yen Bai Joint Stock Forest Agricultural Products And Foodstuff Company,HNX,stock
TCX,CTCP Chứng khoán Kỹ Thương,Techcom Securities Joint Stock Company,HOSE,stock
UIC,CTCP Đầu tư Phát triển Nhà và Đô thị IDICO,Idico Urban and House Development Investment Joint-Stock Company,HOSE,stock
LTG,CTCP Tập đoàn Lộc Trời,Loc Troi Group Joint-Stock Company,UPCOM,stock
DVN,Tổng Công ty Dược Việt Nam - CTCP,Vietnam Pharmaceutical Corporation - Joint Stock Company,UPCOM,stock
ND2,CTCP Đầu tư và Phát triển Điện Miền Bắc 2,Northern Electricity Development and Investment Joint Stock Company No. 2,UPCOM,stock
PTG,CTCP May Xuất khẩu Phan Thiết,Phan Thiet Garment Import - Export Joint Stock Company,UPCOM,stock
TCK,Tổng Công ty Cơ khí Xây dựng - CTCP,Construction Machinery Corporation - JSC,UPCOM,stock
DTI,CTCP Đầu tư Đức Trung,Duc Trung Investment Joint Stock Company,UPCOM,stock
PDC,CTCP Du lịch Dầu khí Phương Đông,Phuong Dong Petroleum Tourism Joint Stock Company,UPCOM,stock
NDN,CTCP Đầu tư Phát triển Nhà Đà Nẵng,Danang Housing Investment Development Joint Stock Company,HNX,stock
BMV,CTCP Bột mỳ Vinafood 1,Vinafood 1 Flour Joint Stock Company,UPCOM,stock
SII,CTCP Hạ tầng Nước Sài Gòn,Sai Gon Water Infrastructure Corporation,UPCOM,stock
SVC,CTCP Dịch vụ Tổng hợp Sài Gòn,Saigon General Service Corporation,HOSE,stock
CIA,CTCP Dịch vụ Sân bay Quốc tế Cam Ranh,Cam Ranh International Airport Services Joint Stock Company,HNX,stock
CSC,CTCP Tập đoàn Cotana,Cotana Group Joint Stock Company,HNX,stock
VUA,CTCP Chứng khoán Stanley Brothers,Stanley Brothers Securities Incorporation,UPCOM,stock
VGV,Tổng Công ty Tư vấn Xây dựng Việt Nam - CTCP,Vietnam National Construction Consultant Corporation - JSC,UPCOM,stock
TCM,CTCP Dệt may - Đầu tư - Thương mại Thành Công,Thanh Cong Textile Garment Investment Trading Joint Stock Company,HOSE,stock
VPD,CTCP Phát triển Điện lực Việt Nam,Vietnam Power Development Joint Stock Company,HOSE,stock
BNA,CTCP Tập đoàn Đầu tư Bảo Ngọc,Bao Ngoc Investment Group Joint Stock Company,HNX,stock
HMG,CTCP Kim khí Hà Nội - VNSTEEL,VNSTEEL - HaNoi Steel Corporation,UPCOM,stock
LTC,CTCP Điện nhẹ Viễn Thông,Low Current - Telecom Joint Stock Company,UPCOM,stock
CDR,CTCP Xây dựng Cao su Đồng Nai,Dong Nai Rubber Construction Joint Stock Company,UPCOM,stock
A32,CTCP 32,32 Joint Stock Company,UPCOM,stock
L61,CTCP Lilama 69-1,Lilama 69-1 Joint Stock Company,UPCOM,stock
VWS,CTCP Nước và Môi Trường Việt Nam,"Vietnam Water, Sanitation and Environment Joint Stock Company",UPCOM,stock
CH5,CTCP Xây dựng Số 5 Hà Nội,HaNoi Construction Joint Stock Company No5,UPCOM,stock
BMI,Tổng Công ty cổ phần Bảo Minh,Bao Minh Insurance Corporation,HOSE,stock
VES,CTCP Đầu tư và Xây dựng Điện Mê Ca Vneco,Me Ca Vneco Investment and Electricity Construction Joint Stock Company,UPCOM,stock
HGM,CTCP Cơ khí và Khoáng sản Hà Giang,Ha Giang Mineral and Mechanics Joint Stock Company,HNX,stock
HDG,CTCP Tập đoàn Hà Đô,Ha Do Group Joint Stock Company,HOSE,stock
TNB,CTCP Thép Nhà Bè - VNSTEEL,VNSTEEL - Nha Be Steel Joint Stock Company,UPCOM,stock
GLC,CTCP Vàng Lào Cai,Lao Cai Gold Joint Stock Company,UPCOM,stock
KSV,Tổng Công ty Khoáng sản TKV - CTCP,Vinacomin - Minerals Holding Corporation,HNX,stock
MQB,CTCP Môi trường và Phát triển Đô thị Quảng Bình,Quang Binh Environment and Urban Development Joint Stock Company,UPCOM,stock
UPC,CTCP Phát triển Công viên Cây xanh và Đô thị Vũng Tàu,Vung Tau Urban and Parks Development Joint Stock Company,UPCOM,stock
TGP,CTCP Trường Phú,Truong Phu Corporation,UPCOM,stock
HMR,CTCP Đá Hoàng Mai,Hoang Mai Stone Joint Stock Company,HNX,stock
D2D,CTCP Phát triển Đô thị Công nghiệp số 2,Industrial Urban Development Joint - Stock Company No 2,HOSE,stock
VSA,CTCP Đại lý Hàng hải Việt Nam,Vietnam Ocean Shipping Agency Corporation,HNX,stock
DCH,CTCP Địa chính Hà Nội,Ha Noi Cadastral Joint Stock Company,UPCOM,stock
HFC,CTCP Xăng dầu HFC,HFC Petrol Joint Stock Company,UPCOM,stock
VIW,Tổng Công ty Đầu tư Nước và Môi trường Việt Nam,Vietnam Water and Environment Investment Corporation - JSC,UPCOM,stock
CRC,CTCP Create Capital Việt Nam,Create Capital Viet Nam Joint Stock Company ,HOSE,stock
EVG,CTCP Tập đoàn EverLand,Everland Group Joint Stock Company,HOSE,stock
VSH,CTCP Thủy điện Vĩnh Sơn - Sông Hinh,Vinh Son - Song Hinh Hydropower Joint Stock Company,HOSE,stock
